{
  "adapter": "groq_vlm_probe",
  "captured_at": null,
  "content_hash": "c551e79f6acdb9e856c53bde15dbcfa953197ee11508fbbe9d5ef01f17fd4e1a",
  "cost": {
    "token_usage": {
      "completion_time": 0.845318598,
      "completion_tokens": 425,
      "prompt_time": 0.166818895,
      "prompt_tokens": 1867,
      "queue_time": 0.972331309,
      "total_time": 1.012137493,
      "total_tokens": 2292
    }
  },
  "device": "remote",
  "latency_ms": 2527.9,
  "model": "qwen/qwen3.6-27b",
  "observation_id": "005-surface-becoming-structure-obs2",
  "output": {
    "answer_sha256": "294888348864fe5b0598fd9a17e5c00685851a5dbc3cb13bd25400703024a407",
    "answer_text": "The single strongest dividing line in this image is the **horizontal band near the bottom**, just above the floor \u2014 specifically, the thick, dark blue-green tile border that separates the lower wall panel (with its repeating star-and-flower geometric pattern) from the floor tiles.\n\n---\n\n**What decides it?**  \nThis division is made by a **change in surface pattern itself** \u2014 not by a structural edge or joint. The upper wall features complex, large-scale medallions and arched niches with intricate floral and geometric motifs, while the lower section transitions into a dense, uniform, small-scale repeating pattern of interlocking stars and flowers. The abrupt shift in scale, density, and motif complexity creates a powerful visual break.\n\nAdditionally, there is a subtle but distinct change in color saturation and texture: the lower band has a slightly darker, more saturated blue-green tone compared to the lighter, more varied blues above, enhancing the perceptual separation.\n\n---\n\n**Do the two agree or disagree at that line?**  \nThey **disagree**.\n\nAbove the line: large-scale, hierarchical composition with focal medallions and architectural forms (arches, niches).  \nBelow the line: flat, continuous, non-hierarchical tessellation with no focal points \u2014 purely decorative and rhythmic.\n\nThe line acts as a visual \u201cfloor\u201d for the ornate upper wall, grounding it and creating a clear boundary between the monumental architecture above and the decorative base below. This disagreement is intentional \u2014 it\u2019s a classic Islamic architectural device to demarcate zones of ornamentation and structure.\n\n---\n\n\u2705 Final Answer:\n\n> The strongest dividing line is the horizontal band near the bottom, separating the lower wall panel from the floor. It is decided by a **change in surface pattern** \u2014 specifically, the abrupt transition from large-scale, hierarchical medallion-and-arch motifs above to a dense, uniform, small-scale geometric tessellation below. The two sides **disagree** at this line: one is architecturally structured and focal; the other is flat, repetitive, and non-hierarchical.",
    "emitted_think_block": false,
    "finish_reason": "stop",
    "image_count": 1,
    "image_path": "/home/adarsh-yadav/Documents/projects/semant/vault/Build/Architecture Lab/Vision pipeline/rehearsals/fixtures/005-surface-becoming-structure/turquoise-tile-revetment.jpg",
    "image_sha256": "b3d660ce9bdcae48c50c64410423ace3f8fa9887aebdd65e13fe91da52716f16",
    "images": [
      {
        "bytes": 150535,
        "path": "/home/adarsh-yadav/Documents/projects/semant/vault/Build/Architecture Lab/Vision pipeline/rehearsals/fixtures/005-surface-becoming-structure/turquoise-tile-revetment.jpg",
        "sha256": "b3d660ce9bdcae48c50c64410423ace3f8fa9887aebdd65e13fe91da52716f16"
      }
    ],
    "latency_ms": 2527.9,
    "model": "qwen/qwen3.6-27b",
    "prompt": "Name the single strongest dividing line in this image. State whether that division is made by the built structure -- an edge, arch, joint or change of plane -- or by a change in the surface pattern itself, and say precisely what decides it. Then say whether the two agree or disagree at that line.",
    "prompt_sha256": "49db631eb2997d503e0fc1870685ccaab02b16aab839e0581c8690942d73b71c",
    "provider": "groq",
    "reasoning_effort": "none",
    "usage": {
      "completion_time": 0.845318598,
      "completion_tokens": 425,
      "prompt_time": 0.166818895,
      "prompt_tokens": 1867,
      "queue_time": 0.972331309,
      "total_time": 1.012137493,
      "total_tokens": 2292
    }
  },
  "provenance": "capture:005-surface-becoming-structure:groq_vlm_probe",
  "request_boundary": "remote_http_groq_openai_v1",
  "uncertainty": null,
  "version": "r2.groq-vlm.1"
}