{
  "adapter": "groq_vlm_probe",
  "captured_at": null,
  "content_hash": "285413ab7f7b361ba9cb05b2b30afa3597af531c966dc139dd6101a40f880bb7",
  "cost": {
    "token_usage": {
      "completion_time": 0.16652678,
      "completion_tokens": 85,
      "prompt_time": 0.072456506,
      "prompt_tokens": 817,
      "queue_time": 0.223749919,
      "total_time": 0.238983286,
      "total_tokens": 902
    }
  },
  "device": "remote",
  "latency_ms": 712.1,
  "model": "qwen/qwen3.6-27b",
  "observation_id": "002-figure-ground-reversal-obs1",
  "output": {
    "answer_sha256": "7a021bc590be34e70283e4d3abbd63811d03cff5e190c2f8bdf8f091cfcfd10a",
    "answer_text": "The space between the Gupta and Pala faces is a dark, empty void \u2014 a stark black background that isolates each sculpture. It contains no objects, textures, or gradients; it is purely negative space. This emptiness serves to visually separate the two distinct artistic styles, emphasizing their individual forms without visual interference. The absence of detail in this gap draws the viewer\u2019s eye directly to the contrasting features of the adjacent heads.",
    "emitted_think_block": false,
    "finish_reason": "stop",
    "image_path": "/home/adarsh-yadav/Documents/projects/semant/vault/Build/Architecture Lab/Vision pipeline/rehearsals/fixtures/002-figure-ground-reversal/five-sculpture-collage.jpg",
    "image_sha256": "c6c9fc86673ba3e7e0c25174c4f422843e644642d2037c9b169a45b9ac6e225f",
    "latency_ms": 712.1,
    "model": "qwen/qwen3.6-27b",
    "prompt": "Look carefully at this image. What is the space BETWEEN the Gupta face and the Pala face doing? Describe only that space, not the faces. 3-5 sentences.",
    "prompt_sha256": "26a1ca0d3bafd8b0d59a4fd2f51bd4c93e209bc0c193a1e19acec645e1f3ab2d",
    "provider": "groq",
    "reasoning_effort": "none",
    "usage": {
      "completion_time": 0.16652678,
      "completion_tokens": 85,
      "prompt_time": 0.072456506,
      "prompt_tokens": 817,
      "queue_time": 0.223749919,
      "total_time": 0.238983286,
      "total_tokens": 902
    }
  },
  "provenance": "capture:002-figure-ground-reversal:groq_vlm_probe",
  "request_boundary": "remote_http_groq_openai_v1",
  "uncertainty": null,
  "version": "r2.groq-vlm.1"
}