{
  "adapter": "groq_vlm_probe",
  "captured_at": null,
  "content_hash": "8b67e829bda1f2bf9fa90f054bbb6500ad7d031038f32adcad86d208e461505d",
  "cost": {
    "token_usage": {
      "completion_time": 1.921264112,
      "completion_tokens": 1012,
      "prompt_time": 0.271749838,
      "prompt_tokens": 3668,
      "queue_time": 0.337337128,
      "total_time": 2.19301395,
      "total_tokens": 4680
    }
  },
  "device": "remote",
  "latency_ms": 3974.7,
  "model": "qwen/qwen3.6-27b",
  "observation_id": "008-kinship-pull-ab-obs1",
  "output": {
    "answer_sha256": "c65294ed25cce85c1e454db9e69f8cc9ddfe3c0178d7d0d10bed0b9cbe499ec6",
    "answer_text": "Here is an analysis of the construction features shown in the two images.\n\n### Analysis of Image 1\n\nThis image displays the interior of a structure built using principles of Islamic architecture, likely a mosque or mausoleum.\n\n-   **What it is made of and how it's put together:** The structure is primarily constructed from brick, which is then entirely covered with intricate ceramic tilework. The most prominent feature is the ceiling, which uses a technique called **muqarnas** (or \"stalactite vaulting\"). This is a form of corbelled vaulting where the weight is distributed through a series of small, niche-like cells that stack upon one another. These cells transition the space from the square walls to the circular dome above. The walls are decorated with large panels of geometric and floral patterns, as well as bands of calligraphy.\n-   **What carries what:** The fundamental load-bearing structure is the underlying brick masonry of the walls and the central dome. The elaborate muqarnas and the decorative tilework are non-structural; they are applied to the surface of the brickwork to create a complex, ornate finish. The muqarnas itself acts as a decorative transition, distributing the visual weight from the walls to the dome.\n-   **Supporting evidence:** The image clearly shows the layered, honeycomb-like structure of the muqarnas. The repeating geometric shapes and the way they interlock are characteristic of this corbelled technique. The presence of extensive tilework, including both floral motifs and Arabic script, confirms the materials and decorative style.\n\n---\n\n### Analysis of Image 2\n\nThis image shows the interior of a Gothic cathedral, focusing on its ceiling and upper walls.\n\n-   **What it is made of and how it's put together:** This structure is built using a **ribbed vault** system, a hallmark of Gothic architecture. It is constructed from stone. The ceiling is formed by a network of arched stone ribs that spring from the tops of the columns. These ribs define the bays of the ceiling and carry the weight of the stone infill panels between them. The walls are largely replaced by massive stained-glass windows, which are held in place by the stone framework (tracery) and the overall structural system.\n-   **What carries what:** The stone ribs are the primary structural elements of the ceiling. They channel the immense weight of the roof down through the columns and piers to the ground. This efficient distribution of weight allows for the walls to be non-load-bearing, enabling the large openings for the stained glass. The glass itself is not structural but is supported by the stone tracery and metal armatures.\n-   **Supporting evidence:** The image clearly shows the intersecting stone ribs forming a star-like pattern on the ceiling. The view looks up towards the apex of the vault, showing how the ribs converge. The large, colorful stained-glass windows filling the spaces between the stone supports are also clearly visible.\n\n---\n\n### Comparison of Construction Features\n\nBased on the analyses above, we can identify the shared and unique features of the two constructions.\n\n**Shared Construction Features:**\n-   **Use of Vaulting:** Both structures employ a form of vaulted ceiling to span a large interior space. Image 1 uses muqarnas vaulting, while Image 2 uses a ribbed vault.\n-   **Complex Geometry:** Both ceilings are defined by intricate geometric patterns created by their structural systems\u2014the honeycomb cells of the muqarnas and the intersecting arcs of the ribbed vault.\n-   **Extensive Surface Decoration:** Both interiors are completely covered in elaborate decoration (tilework in Image 1, stained glass in Image 2) that is integrated into the architectural form.\n\n**Features Belonging to Only One Image:**\n-   **Corbelled Construction (Image 1 only):** The muqarnas in the first image is a corbelled structure, meaning it is built by stacking layers of material without the use of mortar or centering for arches. This is a distinct construction method not seen in the second image.\n-   **Ribbed Vaulting with Stone Infill (Image 2 only):** The second image features a true structural ribbed vault, where stone ribs carry the load of the stone panels between them. This is a different engineering principle from the corbelled muqarnas.\n-   **Stained Glass as a Primary Feature (Image 2 only):** The use of large-scale stained glass windows as a major component of the wall and ceiling structure is unique to the Gothic cathedral in Image 2.\n-   **Ceramic Tilework and Calligraphy (Image 1 only):** The extensive use of glazed ceramic tiles for both decoration and surface covering, along with the integration of calligraphic bands, is a feature unique to the Islamic architecture shown in Image 1.",
    "emitted_think_block": false,
    "finish_reason": "stop",
    "image_count": 2,
    "image_path": "/home/adarsh-yadav/Documents/projects/semant/vault/Build/Architecture Lab/Vision pipeline/rehearsals/fixtures/008-kinship-pull-ab/img1-muqarnas-parent.jpg",
    "image_sha256": "7cf371cd4a10a48b6fc759281007b9bb1cd1189cc773af5a4728d4ab46e54f03",
    "images": [
      {
        "bytes": 136017,
        "path": "/home/adarsh-yadav/Documents/projects/semant/vault/Build/Architecture Lab/Vision pipeline/rehearsals/fixtures/008-kinship-pull-ab/img1-muqarnas-parent.jpg",
        "sha256": "7cf371cd4a10a48b6fc759281007b9bb1cd1189cc773af5a4728d4ab46e54f03"
      },
      {
        "bytes": 398149,
        "path": "/home/adarsh-yadav/Documents/projects/semant/vault/Build/Architecture Lab/Vision pipeline/rehearsals/fixtures/008-kinship-pull-ab/img2-vault-crop.png",
        "sha256": "4e76caff29217bc5d40d9adfdf50133ebe52b4d73572b65143c7701889067b47"
      }
    ],
    "latency_ms": 3974.7,
    "model": "qwen/qwen3.6-27b",
    "prompt": "Here are two images, image 1 and image 2. For each image, say how what is shown is put together \u2014 what it is made of, and what carries what \u2014 and what in the image supports what you say. Then say which of these construction features the two images share, and which belong to only one of them.",
    "prompt_sha256": "6319768b5adb0ff999ac817b450f592119e70853c039252300967b688488bec7",
    "provider": "groq",
    "reasoning_effort": "none",
    "usage": {
      "completion_time": 1.921264112,
      "completion_tokens": 1012,
      "prompt_time": 0.271749838,
      "prompt_tokens": 3668,
      "queue_time": 0.337337128,
      "total_time": 2.19301395,
      "total_tokens": 4680
    }
  },
  "provenance": "capture:008-kinship-pull-ab:groq_vlm_probe",
  "request_boundary": "remote_http_groq_openai_v1",
  "uncertainty": null,
  "version": "r2.groq-vlm.1"
}