{
  "adapter": "groq_vlm_probe",
  "captured_at": null,
  "content_hash": "2ef45b8c68267f4f3ca5b2b502bf95ac99f674b4b00282f411dac81a131ccf8c",
  "cost": {
    "token_usage": {
      "completion_time": 0.078525524,
      "completion_tokens": 34,
      "prompt_time": 0.173058008,
      "prompt_tokens": 1900,
      "queue_time": 0.148392501,
      "total_time": 0.251583532,
      "total_tokens": 1934
    }
  },
  "device": "remote",
  "latency_ms": 858.4,
  "model": "qwen/qwen3.6-27b",
  "observation_id": "002F-single-object-followup-obs2",
  "output": {
    "answer_sha256": "ba67281392a4dc05f919f2f94d5dd193ee0333b03a3c59f801431b4d4289511e",
    "answer_text": "NO_GROUND\nThe space immediately beside and above the sculpted figure group is occupied by a large cross and an ornate marble wall, which are depicted content.",
    "emitted_think_block": false,
    "finish_reason": "stop",
    "image_path": "/home/adarsh-yadav/Documents/projects/semant/vault/Build/Architecture Lab/Vision pipeline/rehearsals/fixtures/002F-pieta-single-object/pieta-in-situ.jpg",
    "image_sha256": "8882d66ff3f9f4c16e13406039ed1412d21fcbad43fc6bb917120ad1f8c0cfe4",
    "latency_ms": 858.4,
    "model": "qwen/qwen3.6-27b",
    "prompt": "In this image, consider ONLY the space immediately beside and above the sculpted figure group -- not the figures themselves. Question: does that space contain any DEPICTED content -- something actually pictured that you could point at? If yes, reply with a normalized bounding box [x0,y0,x1,y1] and name what is depicted there. If nothing is depicted there, reply with exactly NO_GROUND on the first line and then one sentence saying why.",
    "prompt_sha256": "ab83acd14a3248c6fedd6a1afe65fddfeab35730cfedb3dec9fbb2545a8b00ed",
    "provider": "groq",
    "reasoning_effort": "none",
    "usage": {
      "completion_time": 0.078525524,
      "completion_tokens": 34,
      "prompt_time": 0.173058008,
      "prompt_tokens": 1900,
      "queue_time": 0.148392501,
      "total_time": 0.251583532,
      "total_tokens": 1934
    }
  },
  "provenance": "capture:002F-single-object-followup:groq_vlm_probe",
  "request_boundary": "remote_http_groq_openai_v1",
  "uncertainty": null,
  "version": "r2.groq-vlm.1"
}