{
  "adapter": "groq_vlm_probe",
  "captured_at": null,
  "content_hash": "878b954ddff270751f8c3af0534186932f758c862cbd849c1c3bf6ba0b964e9b",
  "cost": {
    "token_usage": {
      "completion_time": 1.363418826,
      "completion_tokens": 667,
      "prompt_time": 0.269371884,
      "prompt_tokens": 3621,
      "queue_time": 0.34406467,
      "total_time": 1.63279071,
      "total_tokens": 4288
    }
  },
  "device": "remote",
  "latency_ms": 2654.0,
  "model": "qwen/qwen3.6-27b",
  "observation_id": "010-sameness-assertion-arm-e-obs0",
  "output": {
    "answer_sha256": "2358258961915595d1ac9e9b5b9d7180d62406a9dcb34b5f9d051328f3cce06c",
    "answer_text": "The two images, while depicting different architectural styles and materials, share a powerful and unifying motif: **the use of intricate, colorful patterns to create a sense of divine order, complexity, and awe-inspiring beauty.**\n\nHere is a breakdown of what supports and contradicts this shared motif:\n\n### What Supports the Shared Motif\n\n-   **Intricate Pattern and Ornamentation:** Both images are defined by their extreme level of detail. The first image showcases the complex geometry of Persian *muqarnas* (stalactite vaulting) and floral tilework. The second image displays the elaborate tracery and narrative scenes within the stained glass of a Gothic cathedral. In both cases, the surface is not left plain but is completely covered in a dense, repeating, and highly detailed pattern.\n-   **Vibrant Color Palette:** Both structures use color as a primary decorative element. The first image relies on the rich blues, turquoises, and golds of glazed ceramic tiles. The second uses the deep blues, reds, and greens of stained glass. The intensity and saturation of the colors in both images are meant to be visually stunning and spiritually uplifting.\n-   **Aspiration and Verticality:** Both compositions draw the viewer's eye upward. The first image shows an iwan (a vaulted hall) that leads the gaze up towards the sky visible at the top. The second image is a direct view looking up into the soaring vaulted ceiling of a church. This shared compositional choice creates a feeling of grandeur and directs attention towards the heavens, reinforcing a spiritual or transcendent theme.\n-   **Symbolism of Light and Complexity:** In both traditions, the complexity of the design is often interpreted as a reflection of the infinite nature of the divine. The way light interacts with the surfaces\u2014glinting off the glossy tiles in the first image and passing through the colored glass in the second\u2014adds a dynamic, ethereal quality that enhances this sense of wonder.\n\n---\n\n### What Contradicts the Shared Motif\n\n-   **Material and Technique:** The fundamental materials are different. The first structure is built from opaque, reflective ceramic tiles set into plaster and brick. Its beauty comes from the surface decoration and the play of light on its glossy finish. The second structure is made of translucent stained glass held in place by lead and stone. Its beauty is created by light passing *through* it, casting colored light into the space below.\n-   **Cultural and Religious Context:** The motifs stem from different artistic and religious traditions. The first image is characteristic of Islamic architecture (likely from Iran), where decoration is predominantly geometric and calligraphic, avoiding figurative representation in sacred spaces. The second image is from a European Gothic cathedral, where stained glass often depicts biblical narratives and figures of saints, using figurative art as a form of storytelling and devotion.\n-   **Nature of the Pattern:** While both are intricate, the underlying logic of the patterns differs. The patterns in the first image are largely abstract, geometric, and floral, creating a sense of infinite, non-representational order. The patterns in the second image, while also containing geometric elements, are frequently organized around figurative scenes, making them more narrative and representational.",
    "emitted_think_block": false,
    "finish_reason": "stop",
    "image_count": 2,
    "image_path": "/home/adarsh-yadav/Documents/projects/semant/vault/Build/Architecture Lab/Vision pipeline/rehearsals/fixtures/008-kinship-pull-ab/img1-muqarnas-parent.jpg",
    "image_sha256": "7cf371cd4a10a48b6fc759281007b9bb1cd1189cc773af5a4728d4ab46e54f03",
    "images": [
      {
        "bytes": 136017,
        "path": "/home/adarsh-yadav/Documents/projects/semant/vault/Build/Architecture Lab/Vision pipeline/rehearsals/fixtures/008-kinship-pull-ab/img1-muqarnas-parent.jpg",
        "sha256": "7cf371cd4a10a48b6fc759281007b9bb1cd1189cc773af5a4728d4ab46e54f03"
      },
      {
        "bytes": 398149,
        "path": "/home/adarsh-yadav/Documents/projects/semant/vault/Build/Architecture Lab/Vision pipeline/rehearsals/fixtures/008-kinship-pull-ab/img2-vault-crop.png",
        "sha256": "4e76caff29217bc5d40d9adfdf50133ebe52b4d73572b65143c7701889067b47"
      }
    ],
    "latency_ms": 2654.0,
    "model": "qwen/qwen3.6-27b",
    "prompt": "These two images share a motif. Say what in the images supports that, and what contradicts it.",
    "prompt_sha256": "0df0c1b99856cb643363776c9358d456e57bae0cfaa0d6a6d5a6374ef95ec752",
    "provider": "groq",
    "reasoning_effort": "none",
    "usage": {
      "completion_time": 1.363418826,
      "completion_tokens": 667,
      "prompt_time": 0.269371884,
      "prompt_tokens": 3621,
      "queue_time": 0.34406467,
      "total_time": 1.63279071,
      "total_tokens": 4288
    }
  },
  "provenance": "capture:010-sameness-assertion-arm-e:groq_vlm_probe",
  "request_boundary": "remote_http_groq_openai_v1",
  "uncertainty": null,
  "version": "r2.groq-vlm.1"
}