{
  "adapter": "groq_vlm_probe",
  "captured_at": null,
  "content_hash": "c03b1411cce7b75194dfd757af704fb7c0423e0a42838fd5606b7e7648f6edf8",
  "cost": {
    "token_usage": {
      "completion_time": 1.335016725,
      "completion_tokens": 682,
      "prompt_time": 0.163887551,
      "prompt_tokens": 1833,
      "queue_time": 0.26372726,
      "total_time": 1.498904276,
      "total_tokens": 2515
    }
  },
  "device": "remote",
  "latency_ms": 2216.0,
  "model": "qwen/qwen3.6-27b",
  "observation_id": "006-narrative-overreach-obs1",
  "output": {
    "answer_sha256": "0d9f2d995e45928d4e6f1e48466a526bfd99bf281d1a19131cd3964923dbbbe3",
    "answer_text": "This photograph shows a close-up view of the famous marble sculpture **\u201cThe Angel of Gethsemane\u201d** (also known as *The Mourning Angel*), located in the **Gethsemane Chapel** at the **National Cathedral in Washington, D.C.** The sculpture was created by **Paul Manship** in 1921 and is one of the most iconic works in the cathedral.\n\n---\n\n### What is happening in the photograph?\n\nThe image captures the angel in a moment of profound grief or exhaustion \u2014 its head bowed onto its arm, which rests on a stone altar or pedestal. One wing is spread wide behind it, while the other droops downward, suggesting collapse or sorrow. The drapery of the robe flows naturally over the legs and feet, which are bare and resting on steps. The lighting highlights the texture of the marble and the emotional weight of the pose.\n\n---\n\n### What in the picture supports this interpretation?\n\n- **Pose and expression**: The angel\u2019s head is resting on its forearm, eyes closed or downcast \u2014 a classic visual cue for mourning, fatigue, or despair.\n- **Wings**: One wing is raised but not in flight; the other hangs limply \u2014 reinforcing the sense of defeat or sorrow rather than triumph or ascension.\n- **Setting**: The presence of classical columns and architectural elements suggests a sacred or monumental space \u2014 consistent with a chapel or memorial.\n- **Material and style**: The white marble, realistic anatomy, and dramatic drapery are characteristic of early 20th-century neoclassical sculpture, matching Manship\u2019s known work.\n- **Inscription visible in background**: In the top portion of the image, part of an inscription reads \u201c...THE LORD IS MY LIGHT AND MY SALVATION...\u201d \u2014 confirming the religious context and location within a Christian cathedral.\n\n---\n\n### What the photograph does NOT let you say:\n\n- **Exact identity of the angel**: While widely known as \u201cThe Angel of Gethsemane,\u201d the photo alone doesn\u2019t label it \u2014 so without prior knowledge, one might not know its name or specific biblical reference (though the setting implies it).\n- **Full scale or surroundings**: The tight framing cuts off much of the chapel interior, so we can\u2019t see how large the sculpture is relative to the space, or what else is around it (e.g., other statues, stained glass, visitors).\n- **Artist or date**: No signature or plaque is visible in the frame, so we cannot determine the sculptor or year from the image alone.\n- **Emotional intent beyond grief**: While the pose strongly suggests sorrow, the photo doesn\u2019t reveal whether the angel is mourning Christ\u2019s impending crucifixion (as traditionally interpreted), or expressing something more abstract like divine compassion or human suffering.\n- **Condition or restoration history**: Though some weathering is visible, the photo doesn\u2019t show signs of damage, repair, or conservation efforts that may have occurred over time.\n\n---\n\n### Conclusion:\n\nThe photograph depicts a powerful, emotionally charged sculpture of a grieving angel in a sacred architectural setting. It conveys themes of sorrow, sacrifice, and spiritual burden through posture, material, and context \u2014 but leaves many details (like exact identity, full environment, or historical provenance) to be inferred or researched externally.",
    "emitted_think_block": false,
    "finish_reason": "stop",
    "image_count": 1,
    "image_path": "/home/adarsh-yadav/Documents/projects/semant/vault/Build/Architecture Lab/Vision pipeline/rehearsals/fixtures/006-narrative-overreach/angel-of-grief-rotunda.jpg",
    "image_sha256": "c5055621ef8782c18898b650941abb4cadca8dc22942c3f1c5021156f1fc3ab5",
    "images": [
      {
        "bytes": 70836,
        "path": "/home/adarsh-yadav/Documents/projects/semant/vault/Build/Architecture Lab/Vision pipeline/rehearsals/fixtures/006-narrative-overreach/angel-of-grief-rotunda.jpg",
        "sha256": "c5055621ef8782c18898b650941abb4cadca8dc22942c3f1c5021156f1fc3ab5"
      }
    ],
    "latency_ms": 2216.0,
    "model": "qwen/qwen3.6-27b",
    "prompt": "What is happening in this photograph? Say what in the picture supports what you say, and what the photograph does not let you say.",
    "prompt_sha256": "aa8dfc4a1c4cedfe9f0139603e4a9f1034fef24f0b8877592cb92b306535dbb8",
    "provider": "groq",
    "reasoning_effort": "none",
    "usage": {
      "completion_time": 1.335016725,
      "completion_tokens": 682,
      "prompt_time": 0.163887551,
      "prompt_tokens": 1833,
      "queue_time": 0.26372726,
      "total_time": 1.498904276,
      "total_tokens": 2515
    }
  },
  "provenance": "capture:006-narrative-overreach:groq_vlm_probe",
  "request_boundary": "remote_http_groq_openai_v1",
  "uncertainty": null,
  "version": "r2.groq-vlm.1"
}