{
  "adapter": "groq_vlm_probe",
  "captured_at": null,
  "content_hash": "0192e6ac6a0834dc79f810b30e46e8916f3efbec440cbe2d8f5096f3f1ea7189",
  "cost": {
    "token_usage": {
      "completion_time": 1.183119925,
      "completion_tokens": 623,
      "prompt_time": 0.27114418,
      "prompt_tokens": 3649,
      "queue_time": 0.306626627,
      "total_time": 1.454264105,
      "total_tokens": 4272
    }
  },
  "device": "remote",
  "latency_ms": 3045.2,
  "model": "qwen/qwen3.6-27b",
  "observation_id": "008-kinship-pull-ab-obs0",
  "output": {
    "answer_sha256": "c7c3e2574d7f7a8e9270bb0b98ccd425b6eb6d0aef5a895fbb3e135392d99ade",
    "answer_text": "Here is an analysis of each image, presented separately as requested.\n\n--- \n\n### Image 1\n\n**What it is:**\nThis image displays the ornate interior of a portal or entrance, characteristic of Persian architecture. The structure is known as a `muqarnas` vault (or stalactite vaulting), which serves as a decorative transition between the square base of the entrance and the semi-circular arch above. This specific example is from the Shah Mosque (Imam Mosque) in Isfahan, Iran.\n\n**Supporting details from the image:**\n-   **Muqarnas Vaulting:** The most prominent feature is the honeycomb-like, three-dimensional geometric structure that fills the spandrels (the space between the arch and the rectangular frame). These intricate, tiered cells are the defining characteristic of `muqarnas`.\n-   **Tilework:** The entire surface is covered in elaborate tilework. You can see:\n    -   **Calligraphy:** Vertical panels on the sides and a horizontal band at the bottom are filled with white Arabic script on a deep blue background. This is likely verses from the Quran.\n    -   **Geometric and Floral Patterns:** The `muqarnas` cells and the spandrels are decorated with complex geometric patterns and stylized floral motifs (arabesques) in a rich palette of cobalt blue, turquoise, gold, and white.\n-   **Architectural Form:** The overall shape is a pointed arch, a common feature in Islamic architecture. The view is looking up into the entrance, emphasizing its grandeur and intricate detail.\n\n--- \n\n### Image 2\n\n**What it is:**\nThis image shows the interior ceiling and upper walls of a Gothic cathedral, looking directly upwards towards the apex of a vaulted ceiling. The style is characteristic of High Gothic architecture, with a strong emphasis on height, light, and intricate structural forms. This appears to be the interior of the Sainte-Chapelle in Paris, France.\n\n**Supporting details from the image:**\n-   **Ribbed Vaulting:** The ceiling is constructed with a system of stone ribs that form a star-like pattern where they intersect. This is a hallmark of Gothic architecture, designed to distribute the weight of the roof and allow for taller, more open spaces.\n-   **Stained Glass Windows:** The walls are almost entirely composed of massive stained-glass windows. The glass is filled with vibrant colors\u2014primarily blues, reds, and purples\u2014and depicts numerous biblical scenes and figures. The light filtering through the glass is a key element of the design.\n-   **Pointed Arches:** The tops of the window openings are formed by pointed arches, another defining feature of the Gothic style.\n-   **Verticality:** The composition of the photograph, looking straight up, emphasizes the soaring height of the space, drawing the eye towards the center of the vaulted ceiling. The slender stone ribs and tall windows all contribute to this sense of vertical aspiration.",
    "emitted_think_block": false,
    "finish_reason": "stop",
    "image_count": 2,
    "image_path": "/home/adarsh-yadav/Documents/projects/semant/vault/Build/Architecture Lab/Vision pipeline/rehearsals/fixtures/008-kinship-pull-ab/img1-muqarnas-parent.jpg",
    "image_sha256": "7cf371cd4a10a48b6fc759281007b9bb1cd1189cc773af5a4728d4ab46e54f03",
    "images": [
      {
        "bytes": 136017,
        "path": "/home/adarsh-yadav/Documents/projects/semant/vault/Build/Architecture Lab/Vision pipeline/rehearsals/fixtures/008-kinship-pull-ab/img1-muqarnas-parent.jpg",
        "sha256": "7cf371cd4a10a48b6fc759281007b9bb1cd1189cc773af5a4728d4ab46e54f03"
      },
      {
        "bytes": 398149,
        "path": "/home/adarsh-yadav/Documents/projects/semant/vault/Build/Architecture Lab/Vision pipeline/rehearsals/fixtures/008-kinship-pull-ab/img2-vault-crop.png",
        "sha256": "4e76caff29217bc5d40d9adfdf50133ebe52b4d73572b65143c7701889067b47"
      }
    ],
    "latency_ms": 3045.2,
    "model": "qwen/qwen3.6-27b",
    "prompt": "Here are two images, image 1 and image 2. Take each image on its own. For image 1, say what it is, and what in the image supports what you say. Then do the same for image 2.",
    "prompt_sha256": "b07c9ef9dcfc277b6d47f056f5758eda8ac1ccb57b0614ded62558ff6effca6b",
    "provider": "groq",
    "reasoning_effort": "none",
    "usage": {
      "completion_time": 1.183119925,
      "completion_tokens": 623,
      "prompt_time": 0.27114418,
      "prompt_tokens": 3649,
      "queue_time": 0.306626627,
      "total_time": 1.454264105,
      "total_tokens": 4272
    }
  },
  "provenance": "capture:008-kinship-pull-ab:groq_vlm_probe",
  "request_boundary": "remote_http_groq_openai_v1",
  "uncertainty": null,
  "version": "r2.groq-vlm.1"
}