{
  "adapter": "groq_vlm_probe",
  "captured_at": null,
  "content_hash": "a6b2615a70a50d61018e80f31ed1fe5be3f51cd7285c15871f9b498cf6834b7d",
  "cost": {
    "token_usage": {
      "completion_time": 1.318309293,
      "completion_tokens": 695,
      "prompt_time": 0.250009151,
      "prompt_tokens": 3621,
      "queue_time": 0.296388385,
      "total_time": 1.568318444,
      "total_tokens": 4316
    }
  },
  "device": "remote",
  "latency_ms": 9401.4,
  "model": "qwen/qwen3.6-27b",
  "observation_id": "012-repeat-stability-obs2",
  "output": {
    "answer_sha256": "7531ece320ad267ec50af3af0eed00020e45eafc9c23af1c539ca2c1e037aa78",
    "answer_text": "The two images share a powerful architectural and aesthetic motif, but they also present significant contradictions in their execution and cultural context.\n\n### What Supports the Shared Motif\n\nThe primary shared motif is the **celestial or heavenly canopy**. Both images depict an ornate ceiling designed to evoke a sense of looking up into a divine or otherworldly space.\n\n-   **Radial Symmetry and Convergence:** Both ceilings use a strong radial composition. The first image (the Shah Cheragh shrine) features a central point from which intricate, honeycomb-like muqarnas vaulting radiates outwards. The second image (the Sagrada Fam\u00edlia) shows stone ribs converging towards a central point high above, creating a similar starburst effect. This shared geometry draws the eye upward and creates a focal point, mimicking the rays of light from a celestial body.\n-   **Abundance of Color and Light:** Both spaces are defined by their vibrant, jewel-like colors. The first uses glazed tiles in shades of blue, turquoise, and gold. The second uses stained glass that filters light into a spectrum of reds, blues, greens, and purples. In both cases, the color is not merely decorative but integral to creating an ethereal, luminous atmosphere.\n-   **Intricate, Repetitive Patterns:** Both ceilings are covered in complex, repeating patterns that create a sense of infinite detail. The first uses geometric and floral tilework, while the second uses the tracery of the stained glass and the structural ribs. This complexity can be overwhelming, encouraging contemplation and a feeling of being immersed in a grand, divine creation.\n\n---\n\n### What Contradicts the Motif\n\nDespite the shared theme, the methods and underlying philosophies of the two designs are fundamentally different.\n\n-   **Material and Technique:**\n    -   **Image 1 (Shah Cheragh):** The decoration is applied to the surface. The structure is made of brick and plaster, and it is then covered with millions of small, colorful ceramic tiles. The beauty is in the surface ornamentation.\n    -   **Image 2 (Sagrada Fam\u00edlia):** The decoration is structural and integral. The \"color\" comes from light passing through the stained glass, and the \"pattern\" is formed by the load-bearing stone ribs themselves. The form and the decoration are one and the same.\n-   **Source of Light:**\n    -   **Image 1:** The light is reflected. The glossy tiles catch and reflect ambient light, creating a shimmering, static brilliance.\n    -   **Image 2:** The light is transmitted. The stained glass acts as a filter, transforming natural sunlight into a dynamic, colored glow that changes throughout the day. The light itself is the primary decorative element.\n-   **Cultural and Religious Expression:**\n    -   **Image 1:** This is an example of Islamic art, which traditionally avoids figurative representation in religious contexts. The decoration is abstract, using geometry, calligraphy (visible on the side panels), and stylized floral motifs to express the infinite nature of God.\n    -   **Image 2:** This is a Christian cathedral. The stained glass windows are filled with figurative scenes from the Bible, depicting saints, prophets, and biblical stories. The art is narrative and representational, intended to teach and inspire through specific religious imagery.",
    "emitted_think_block": false,
    "finish_reason": "stop",
    "image_count": 2,
    "image_path": "/home/adarsh-yadav/Documents/projects/semant/vault/Build/Architecture Lab/Vision pipeline/rehearsals/fixtures/008-kinship-pull-ab/img1-muqarnas-parent.jpg",
    "image_sha256": "7cf371cd4a10a48b6fc759281007b9bb1cd1189cc773af5a4728d4ab46e54f03",
    "images": [
      {
        "bytes": 136017,
        "path": "/home/adarsh-yadav/Documents/projects/semant/vault/Build/Architecture Lab/Vision pipeline/rehearsals/fixtures/008-kinship-pull-ab/img1-muqarnas-parent.jpg",
        "sha256": "7cf371cd4a10a48b6fc759281007b9bb1cd1189cc773af5a4728d4ab46e54f03"
      },
      {
        "bytes": 398149,
        "path": "/home/adarsh-yadav/Documents/projects/semant/vault/Build/Architecture Lab/Vision pipeline/rehearsals/fixtures/008-kinship-pull-ab/img2-vault-crop.png",
        "sha256": "4e76caff29217bc5d40d9adfdf50133ebe52b4d73572b65143c7701889067b47"
      }
    ],
    "latency_ms": 9401.4,
    "model": "qwen/qwen3.6-27b",
    "prompt": "These two images share a motif. Say what in the images supports that, and what contradicts it.",
    "prompt_sha256": "0df0c1b99856cb643363776c9358d456e57bae0cfaa0d6a6d5a6374ef95ec752",
    "provider": "groq",
    "reasoning_effort": "none",
    "usage": {
      "completion_time": 1.318309293,
      "completion_tokens": 695,
      "prompt_time": 0.250009151,
      "prompt_tokens": 3621,
      "queue_time": 0.296388385,
      "total_time": 1.568318444,
      "total_tokens": 4316
    }
  },
  "provenance": "capture:012-repeat-stability:groq_vlm_probe",
  "request_boundary": "remote_http_groq_openai_v1",
  "uncertainty": null,
  "version": "r2.groq-vlm.1"
}